{
  "schema_version": 1,
  "from_run": "20260904T024522Z",
  "to_run": "20260904T024532Z",
  "added": {
    "hosts": [],
    "vhosts": [],
    "ports": [],
    "services": [],
    "passive_ips": []
  },
  "removed": {
    "hosts": [],
    "vhosts": [],
    "ports": [],
    "services": [],
    "passive_ips": []
  },
  "changed": {
    "hosts": [],
    "vhosts": [],
    "ports": [],
    "services": [],
    "passive_ips": []
  }
}
