{
  "schema_version": 1,
  "from_run": "20260904T123246Z",
  "to_run": "20260904T152855Z",
  "added": {
    "hosts": [],
    "vhosts": [],
    "ports": [],
    "services": [],
    "passive_ips": []
  },
  "removed": {
    "hosts": [],
    "vhosts": [],
    "ports": [],
    "services": [],
    "passive_ips": []
  },
  "changed": {
    "hosts": [
      {
        "before": {
          "host": "example.com",
          "ips": [],
          "alive": null,
          "attribution": "active",
          "sources": [
            "dns-resolve"
          ]
        },
        "after": {
          "host": "example.com",
          "ips": [
            "172.66.147.243",
            "104.20.23.154",
            "2606:4700:10::ac42:93f3",
            "2606:4700:10::6814:179a"
          ],
          "alive": null,
          "attribution": "active",
          "sources": [
            "dns-resolve"
          ]
        }
      }
    ],
    "vhosts": [],
    "ports": [],
    "services": [],
    "passive_ips": []
  }
}
