{
  "schema_version": 1,
  "from_run": "20260904T024747Z",
  "to_run": "20260904T025342Z",
  "added": {
    "hosts": [
      {
        "host": "probe.example.com",
        "ips": [],
        "alive": null,
        "attribution": "passive",
        "sources": [
          "echo-probe"
        ]
      }
    ],
    "vhosts": [],
    "ports": [],
    "services": [],
    "passive_ips": []
  },
  "removed": {
    "hosts": [],
    "vhosts": [],
    "ports": [],
    "services": [],
    "passive_ips": []
  },
  "changed": {
    "hosts": [],
    "vhosts": [],
    "ports": [],
    "services": [],
    "passive_ips": []
  }
}
