{
  "schema_version": 1,
  "from_run": "20260904T030414Z",
  "to_run": "20260904T112747Z",
  "added": {
    "hosts": [],
    "vhosts": [],
    "ports": [],
    "services": [],
    "passive_ips": []
  },
  "removed": {
    "hosts": [
      {
        "host": "api.example.com",
        "ips": [],
        "alive": null,
        "attribution": "active",
        "sources": [
          "echo-tool-active"
        ]
      },
      {
        "host": "mail.example.com",
        "ips": [],
        "alive": null,
        "attribution": "passive",
        "sources": [
          "echo-tool"
        ]
      },
      {
        "host": "www.example.com",
        "ips": [],
        "alive": null,
        "attribution": "both",
        "sources": [
          "echo-tool",
          "echo-tool-active"
        ]
      }
    ],
    "vhosts": [],
    "ports": [],
    "services": [],
    "passive_ips": []
  },
  "changed": {
    "hosts": [],
    "vhosts": [],
    "ports": [],
    "services": [],
    "passive_ips": []
  }
}
