{
  "schema_version": 1,
  "from_run": "20200101T000000Z",
  "to_run": "20200102T000000Z",
  "added": {
    "hosts": [
      {
        "host": "new.example.com",
        "attribution": "active",
        "sources": [
          "echo-tool-active"
        ],
        "ips": []
      }
    ],
    "vhosts": [],
    "ports": [],
    "services": [],
    "passive_ips": []
  },
  "removed": {
    "hosts": [],
    "vhosts": [],
    "ports": [],
    "services": [],
    "passive_ips": []
  },
  "changed": {
    "hosts": [
      {
        "before": {
          "host": "old.example.com",
          "attribution": "passive",
          "sources": [
            "echo-tool"
          ],
          "ips": []
        },
        "after": {
          "host": "old.example.com",
          "attribution": "both",
          "sources": [
            "echo-tool",
            "echo-tool-active"
          ],
          "ips": [
            "1.2.3.4"
          ]
        }
      }
    ],
    "vhosts": [],
    "ports": [],
    "services": [],
    "passive_ips": []
  }
}
